{"$id":"urn:acme-firm:schema:generation-topology:1.0.0","$schema":"https://json-schema.org/draft/2020-12/schema","additionalProperties":false,"description":"DAG canónico y reglas de aciclicidad de la generación reproducible.","properties":{"$schema":{"const":"../schemas/generation_topology.schema.json","type":"string"},"acyclicity_rules":{"const":["a generator may read only declared predecessor nodes","no derived output may alter an authored input, generator, scenario or oracle","SOURCE_SHA256.txt excludes itself and all derived descendants","MANIFIESTO_SHA256.txt excludes itself","BUILD_RECORD.json does not contain the final manifest hash, ZIP hash, wall-clock timestamp or duration","the ZIP and external sidecars remain outside the package root and outside the package manifest"],"type":"array"},"build_order":{"const":["validate authored source, decision, thesis and binding layers","resolve config/resolved_instance.json","validate and freeze input-only scenarios and independent oracles","run python3 -I -B -X utf8 scripts/build_source_manifest.py --root . --output manifests/SOURCE_SHA256.txt","run python3 -I -B -X utf8 scripts/verify_manifest.py --root . --manifest manifests/SOURCE_SHA256.txt and require exit code zero","run the reference scenario recipe and unit tests","validate coverage and all generated outputs","execute every validator_registry entry and require zero exit codes","write manifests/BUILD_RECORD.json","generate and verify MANIFIESTO_SHA256.txt","build deterministic ZIP and its external SHA-256 sidecar"],"type":"array"},"build_record_path":{"const":"manifests/BUILD_RECORD.json","type":"string"},"dag":{"const":["frozen authored inputs plus all generator and validator files -> scripts/build_source_manifest.py","scripts/build_source_manifest.py -> manifests/SOURCE_SHA256.txt while excluding the manifest output itself and all derived descendants","manifests/SOURCE_SHA256.txt -> pre-run scripts/verify_manifest.py gate","verified manifests/SOURCE_SHA256.txt, which includes frozen scenarios and oracles, -> reference run and tests","reference run and tests -> reference-derived results, traces, rejection, logs and summaries","validated reference-derived outputs plus the internal review -> registered validators","registered validators with zero exit codes -> manifests/BUILD_RECORD.json","all package files except final manifest -> MANIFIESTO_SHA256.txt","frozen package tree -> deterministic ZIP outside package root","deterministic ZIP -> external .zip.sha256 sidecar"],"type":"array"},"failure_policy":{"const":"any missing predecessor, count mismatch, schema failure, hash mismatch, unresolved ledger target or nonzero command exit stops all downstream nodes","type":"string"},"manual_editing_of_derived_nodes":{"const":"prohibited","type":"string"},"recipe_path":{"const":"manifests/BUILD_RECIPE.json","type":"string"},"schema_version":{"const":"1.0.0","type":"string"},"source_manifest_path":{"const":"manifests/SOURCE_SHA256.txt","type":"string"},"status":{"const":"planned_not_executed","type":"string"},"topology_id":{"const":"TOPOLOGY-IFM6-1.1.0-CANDIDATE-001","type":"string"}},"required":["$schema","schema_version","topology_id","status","recipe_path","source_manifest_path","build_record_path","dag","acyclicity_rules","build_order","failure_policy","manual_editing_of_derived_nodes"],"title":"IFATIGUE-INFRA6-M6 generation topology contract","type":"object"}
